{"accepted_at_utc":"2026-08-14T00:00:01Z","authority":["test-owned component map"],"components":[{"component_id":"results","component_type":"artifact","elements":[{"element_id":"accuracy","evidence_locators":[],"relation_type":"measures","target":"reported accuracy"}]}],"created_at_utc":"2026-08-14T00:00:00Z","integrity":{"canonical_payload_sha256":"aa50ad55448dc435ac37677b4be69826e2ada71bc468ac6f87d1ec52b3164841"},"map_id":"component-map-5fc2185d6b5c","map_state":"accepted","mapper_version":"1.2.0","objective":"Provide a bounded structural authority for recorder tests.","origin_scan_id":"fixture-scan","previous_map_id":null,"schema_version":"1.0","scope":["focused evidence-bound recorder fixture"],"skill_name":"analyze-project-claims","skill_sha256":"7b944431552e728d1f23f730f472ac5a5c92d87010ed9a271160b1dc9cbc9cd0","source_snapshot":[]}
