{
  "accepted_at_utc": "2026-08-08T10:23:29.467911Z",
  "authority": [
    "skill/analyze-project-claims/SKILL.md",
    "skill/analyze-project-claims/references/component-map.schema.json",
    "skill/analyze-project-claims/references/scan-record.schema.json",
    "tests/test_component_map.py",
    "tests/test_record_scan.py"
  ],
  "components": [
    {
      "component_id": "component-map-lifecycle",
      "component_type": "code",
      "elements": [
        {
          "element_id": "drift-and-conflict-preservation",
          "evidence_locators": [
            {
              "locator": "test_stale_source_produces_delta and test_conflict_produces_candidate_without_overwrite",
              "source": "tests/test_component_map.py"
            }
          ],
          "relation_type": "contains",
          "target": "Source drift or same-ID semantic conflict emits candidate/delta evidence while preserving the accepted map."
        },
        {
          "element_id": "missing-map-bootstrap",
          "evidence_locators": [
            {
              "locator": "test_missing_map_bootstraps_provisional",
              "source": "tests/test_component_map.py"
            }
          ],
          "relation_type": "contains",
          "target": "A missing accepted map produces only a provisional candidate and an append-only history event."
        },
        {
          "element_id": "unchanged-map-reuse",
          "evidence_locators": [
            {
              "locator": "test_valid_map_is_checked_without_rebuild",
              "source": "tests/test_component_map.py"
            }
          ],
          "relation_type": "contains",
          "target": "An unchanged accepted map is checked and reused without a replacement candidate or delta."
        }
      ]
    },
    {
      "component_id": "distribution",
      "component_type": "artifact",
      "elements": [
        {
          "element_id": "official-skill-validation",
          "evidence_locators": [
            {
              "locator": "skill-creator/scripts/quick_validate.py on four roots",
              "source": "skill/analyze-project-claims"
            }
          ],
          "relation_type": "contains",
          "target": "Skill metadata and referenced resources in staging, export, Downloads, and installed copies."
        }
      ]
    },
    {
      "component_id": "paper-facing-boundaries",
      "component_type": "claim",
      "elements": [
        {
          "element_id": "bounded-readme-claims",
          "evidence_locators": [
            {
              "locator": "Research status and Paper-facing evaluation plan",
              "source": "README.md"
            }
          ],
          "relation_type": "contains",
          "target": "README distinguishes deterministic behavior evidence from cross-project reliability and general RAG benefit."
        },
        {
          "element_id": "cross-project-reliability",
          "evidence_locators": [],
          "relation_type": "contains",
          "target": "General reliability across projects, agents, models, and domains."
        },
        {
          "element_id": "identified-release-metadata",
          "evidence_locators": [
            {
              "locator": "placeholder fields",
              "source": "CITATION.cff.template"
            }
          ],
          "relation_type": "contains",
          "target": "Final authorship, repository URL, DOI, and author-approved software license."
        }
      ]
    },
    {
      "component_id": "scan-logging",
      "component_type": "code",
      "elements": [
        {
          "element_id": "hierarchical-scan-record",
          "evidence_locators": [
            {
              "locator": "py -m unittest discover -s tests -v",
              "source": "tests/test_record_scan.py"
            }
          ],
          "relation_type": "contains",
          "target": "Element-level evidence method, check status, claim status, interpretation, and repair are persisted hierarchically."
        },
        {
          "element_id": "repository-regression",
          "evidence_locators": [
            {
              "locator": "py -m pytest -q",
              "source": "tests/test_component_map.py"
            }
          ],
          "relation_type": "contains",
          "target": "The expanded package does not break active repository contracts."
        }
      ]
    }
  ],
  "created_at_utc": "2026-08-08T10:23:28.915646Z",
  "integrity": {
    "canonical_payload_sha256": "41d794c6ce8931d1ddc1ba20e2c5190535256752f309b445adaf9cc907030edb"
  },
  "map_id": "component-map-027d84f8587e",
  "map_state": "accepted",
  "mapper_version": "1.0.0",
  "objective": "Audit the v0.2.0 public package for component-map lifecycle safety, append-only scan logging, distribution parity, and bounded paper-facing claims.",
  "origin_scan_id": "20260808T102328915646Z-741ae2a0",
  "previous_map_id": null,
  "schema_version": "1.0",
  "scope": [
    "README.md",
    "VERSION",
    "CITATION.cff.template",
    "skill/analyze-project-claims",
    "tests/test_component_map.py",
    "tests/test_record_scan.py"
  ],
  "skill_name": "analyze-project-claims",
  "skill_sha256": "60565e2e98dc2b9f65de1517d2afda9fc636edeab5ecf640ed1731592764d80c",
  "source_snapshot": [
    {
      "exists": true,
      "kind": "file",
      "sha256": "500ed7a11bb3f7d07806eb3053d7d956ee6dd042a351254a7d35cf3ec39fbd1f",
      "source": "CITATION.cff.template"
    },
    {
      "exists": true,
      "kind": "file",
      "sha256": "bfb693d0adf0eac534ed6cc81be0ab614b2caa39a2f0df193245e7a089ba2ac9",
      "source": "README.md"
    },
    {
      "exists": true,
      "kind": "file",
      "sha256": "1f930dd1f133c1f97a94fe3acb8db34372cf4c01ffdb2b3ff4ca72f9494121e9",
      "source": "VERSION"
    },
    {
      "exists": true,
      "kind": "directory",
      "sha256": "73cf76e3af129502efe21dca45f4ecb1d800cfa3b32419b2b0f526309129495b",
      "source": "skill/analyze-project-claims"
    },
    {
      "exists": true,
      "kind": "file",
      "sha256": "60565e2e98dc2b9f65de1517d2afda9fc636edeab5ecf640ed1731592764d80c",
      "source": "skill/analyze-project-claims/SKILL.md"
    },
    {
      "exists": true,
      "kind": "file",
      "sha256": "5192711cfaf15015d3b634505423b872baf807818ec64c0a4571f5eb69053789",
      "source": "skill/analyze-project-claims/references/component-map.schema.json"
    },
    {
      "exists": true,
      "kind": "file",
      "sha256": "20cc271522ceeeecb6a4e3ebf3e81721c7542d2dfdef6398af8162c88cf6101c",
      "source": "skill/analyze-project-claims/references/scan-record.schema.json"
    },
    {
      "exists": true,
      "kind": "file",
      "sha256": "2e9e5fa6639834e2b855657951afd3871817056b87a58c30563ac3f27b6e2452",
      "source": "tests/test_component_map.py"
    },
    {
      "exists": true,
      "kind": "file",
      "sha256": "dc0d007188570416b657082f371eb80beb0fc3df645869ea06cd84763636a39b",
      "source": "tests/test_record_scan.py"
    }
  ]
}
